article_title,article_link,article_date,article_id
Debunking the Solar-Cycle/North Atlantic Winter Weather Connection,https://science.fas.columbia.edu/news/debunking-the-solar-cyclenorth-atlantic-winter-weather-connection/,"January 22, 2019",columbia_251
Climate-Driven Fires Could Turn Yellowstone Forests to Grassland By Midcentury,https://science.fas.columbia.edu/news/climate-driven-fires-could-turn-yellowstone-forests-to-grassland-by-midcentury/,"January 17, 2019",columbia_252
"Novel Materials Convert Visible Light into Infrared Light, Opening Up New Routes for Photodynamic Therapy and Drug Development",https://science.fas.columbia.edu/news/novel-materials-convert-visible-light-into-infrared-light-opening-up-new-routes-for-photodynamic-therapy-and-drug-development/,"January 16, 2019",columbia_253
"Heating Buildings Leaves a Huge Carbon Footprint, But There’s a Fix For It",https://science.fas.columbia.edu/news/heating-buildings-leaves-a-huge-carbon-footprint-but-theres-a-fix-for-it/,"January 15, 2019",columbia_254
Genes on the Move Help Nose Make Sense of Scents,https://science.fas.columbia.edu/news/genes-on-the-move-help-nose-make-sense-of-scents/,"January 9, 2019",columbia_255
Scientists Work to Build Climate Change Resilience in Caribbean Coral Reef,https://science.fas.columbia.edu/news/scientists-work-to-build-climate-change-resilience-in-caribbean-coral-reef/,"January 8, 2019",columbia_256
"Columbia University Researchers Identify Genes in Worms that Drive Sex Differences in Brain Development, Timing of Puberty",https://science.fas.columbia.edu/news/columbia-university-researchers-identify-genes-in-worms-that-drive-sex-differences-in-brain-development-timing-of-puberty/,"January 1, 2019",columbia_257
A New Party Trick: A Hearing Aid That Reads Minds,https://science.fas.columbia.edu/news/a-new-party-trick-a-hearing-aid-that-reads-minds/,"December 30, 2018",columbia_258
New Report Examines Key Steps Forward in Removing Carbon Dioxide from Air,https://science.fas.columbia.edu/news/new-report-examines-key-steps-forward-in-removing-carbon-dioxide-from-air/,"December 20, 2018",columbia_259
Simon Tavaré Takes Aim at Cancer with Math,https://science.fas.columbia.edu/news/simon-tavare-takes-aim-at-cancer-with-math/,"December 18, 2018",columbia_260
How Can We Use the National Climate Assessment to Prepare for Climate Change?,https://science.fas.columbia.edu/news/how-can-we-use-the-national-climate-assessment-to-prepare-for-climate-change/,"December 17, 2018",columbia_261
Africa: An Air Pollution Wildcard,https://science.fas.columbia.edu/news/africa-an-air-pollution-wildcard/,"December 14, 2018",columbia_262
Study Finds Sewage Bacteria Lurking in Hudson River Sediments,https://science.fas.columbia.edu/news/study-finds-sewage-bacteria-lurking-in-hudson-river-sediments/,"December 13, 2018",columbia_263
"Climate Change Has Made Western Megadrought 38 Percent More Severe, Say New Estimates",https://science.fas.columbia.edu/news/climate-change-has-made-western-megadrought-38-percent-more-severe-say-new-estimates/,"December 13, 2018",columbia_264
Unlocking the Memories Inside Our Minds,https://science.fas.columbia.edu/news/unlocking-the-memories-inside-our-minds/,"December 10, 2018",columbia_265
Assessing the Impact of Declining Arctic Sea Ice on Extreme Weather,https://science.fas.columbia.edu/news/assessing-the-impact-of-declining-arctic-sea-ice-on-extreme-weather/,"December 10, 2018",columbia_266
"Friend or Foe? Brain Area That Controls Social Memory Also Triggers Aggression, Mouse Study Reveals",https://science.fas.columbia.edu/news/friend-or-foe-brain-area-that-controls-social-memory-also-triggers-aggression-mouse-study-reveals/,"December 5, 2018",columbia_267
National Climate Assessment: Threats to U.S. International Interests,https://science.fas.columbia.edu/news/national-climate-assessment-threats-to-u-s-international-interests/,"November 28, 2018",columbia_268
Support the Sciences at Columbia on Giving Tuesday,https://science.fas.columbia.edu/news/support-the-sciences-at-columbia-on-giving-tuesday/,"November 27, 2018",columbia_269
"Why Small Size Matters: Tiny Mitochondria Stimulate Brain Cell Connections, Columbia Study Shows",https://science.fas.columbia.edu/news/why-small-size-matters-tiny-mitochondria-stimulate-brain-cell-connections-columbia-study-shows/,"November 27, 2018",columbia_270
National Climate Assessment: Will U.S. Water Problems Worsen?,https://science.fas.columbia.edu/news/national-climate-assessment-will-u-s-water-problems-worsen/,"November 26, 2018",columbia_271
"When Storing Memories, Brain Prioritizes Those Experiences That Are Most Rewarding",https://science.fas.columbia.edu/news/when-storing-memories-brain-prioritizes-those-experiences-that-are-most-rewarding/,"November 26, 2018",columbia_272
New Study Highlights Complexity of Warming and Melting in Antarctica,https://science.fas.columbia.edu/news/new-study-highlights-complexity-of-warming-and-melting-in-antarctica/,"November 19, 2018",columbia_273
CleanTech: Designing Batteries for a Sustainable Future,https://science.fas.columbia.edu/news/cleantech-designing-batteries-for-a-sustainable-future/,"November 15, 2018",columbia_274
A New Primer on Climate Change,https://science.fas.columbia.edu/news/a-new-primer-on-climate-change/,"November 14, 2018",columbia_275
Columbia University Receives Grant from the Amgen Foundation to Continue Hosting the Amgen Scholars Program,https://science.fas.columbia.edu/news/columbia-university-receives-grant-from-the-amgen-foundation-to-continue-hosting-the-amgen-scholars-program/,"November 13, 2018",columbia_276
"Yes, Climate Change is Making Wildfires Worse",https://science.fas.columbia.edu/news/yes-climate-change-is-making-wildfires-worse/,"November 9, 2018",columbia_277
Columbia-led Team Receives $16.75M from BRAIN Initiative in Effort to Build Blueprint of Brain’s Visual System,https://science.fas.columbia.edu/news/columbia-led-team-receives-16-75m-from-brain-initiative-in-effort-to-build-blueprint-of-brains-visual-system/,"November 8, 2018",columbia_278
Election Day: The Brain Science of Making Decisions,https://science.fas.columbia.edu/news/election-day-the-brain-science-of-making-decisions/,"November 1, 2018",columbia_279
