article_title,article_link,article_date,article_id
"8 Surprising Facts About Marie Tharp, Mapmaker Extraordinaire",https://science.fas.columbia.edu/news/8-surprising-facts-about-marie-tharp-mapmaker-extraordinaire/,"July 29, 2020",columbia_0
Columbia Chemistry Receives $21.5 Million Gift from Dr. Ge Li and Dr. Ning Zhao,https://science.fas.columbia.edu/news/columbia-chemistry-receives-21-5-million-gift-from-dr-ge-li-and-dr-ning-zhao/,"July 28, 2020",columbia_1
Columbia Astrophysicist Brian Metzger Named 2020 Blavatnik Laureate,https://science.fas.columbia.edu/news/columbia-astrophysicist-brian-metzger-named-2020-blavatnik-laureate/,"July 22, 2020",columbia_2
Lamont-Doherty Program Aims to Bring More Diversity to Earth Science,https://science.fas.columbia.edu/news/lamont-doherty-program-aims-to-bring-more-diversity-to-earth-science/,"July 22, 2020",columbia_3
Genetics Could Protect Coral Reefs from Global Warming,https://science.fas.columbia.edu/news/genetics-could-protect-coral-reefs-from-global-warming/,"July 16, 2020",columbia_4
Groundbreaking Project Will Drill Into Bedrock Below Greenland Ice to Understand Past and Future Melting,https://science.fas.columbia.edu/news/groundbreaking-project-will-drill-into-bedrock-below-greenland-ice-to-understand-past-and-future-melting/,"July 16, 2020",columbia_5
Understanding and Predicting Hurricanes in a Warmer World,https://science.fas.columbia.edu/news/understanding-and-predicting-hurricanes-in-a-warmer-world/,"July 13, 2020",columbia_6
Columbia to Establish a Climate School to Meet the Challenges of a Warming World,https://science.fas.columbia.edu/news/columbia-to-establish-a-climate-school-to-meet-the-challenges-of-a-warming-world/,"July 10, 2020",columbia_7
Scientists Warn of Wide Impacts on Midwaters Around Deep-Sea Mining Sites,https://science.fas.columbia.edu/news/scientists-warn-of-wide-impacts-on-midwaters-around-deep-sea-mining-sites/,"July 8, 2020",columbia_8
Tree Rings Show Unprecedented Rise in Extreme Weather in South America,https://science.fas.columbia.edu/news/tree-rings-show-unprecedented-rise-in-extreme-weather-in-south-america/,"July 7, 2020",columbia_9
2D Semiconductors Found to Be Close-To-Ideal Fractional Quantum Hall Platform,https://science.fas.columbia.edu/news/2d-semiconductors-found-to-be-close-to-ideal-fractional-quantum-hall-platform/,"July 6, 2020",columbia_10
Columbia Researchers Receive Facebook Award to Enhance Probabilistic Programming,https://science.fas.columbia.edu/news/columbia-researchers-receive-facebook-award-to-enhance-probabilistic-programming/,"July 1, 2020",columbia_11
Geologists Identify Deep-Earth Structures That May Signal Hidden Metal Lodes,https://science.fas.columbia.edu/news/geologists-identify-deep-earth-structures-that-may-signal-hidden-metal-lodes/,"June 30, 2020",columbia_12
Columbia Engineers to Develop Power Grid Risk Dashboard,https://science.fas.columbia.edu/news/columbia-engineers-to-develop-power-grid-risk-dashboard/,"June 26, 2020",columbia_13
Columbia Neuroscientist Rui Costa Joins International Consortium to Decode How the Brain Moves the Body,https://science.fas.columbia.edu/news/columbia-neuroscientist-rui-costa-joins-international-consortium-to-decode-how-the-brain-moves-the-body/,"June 24, 2020",columbia_14
Eric Talley Spearheads the Use of Machine Learning to Study Law,https://science.fas.columbia.edu/news/eric-talley-spearheads-the-use-of-machine-learning-to-study-law/,"June 19, 2020",columbia_15
Four Columbia Professors Named Finalists for Blavatnik Award for Young Scientists,https://science.fas.columbia.edu/news/four-columbia-professors-named-finalists-for-blavatnik-award-for-young-scientists/,"June 17, 2020",columbia_16
What is the Cerebellum?,https://science.fas.columbia.edu/news/what-is-the-cerebellum/,"June 15, 2020",columbia_17
Refining Projections of Antarctic Ice Loss and Global Sea Level Rise,https://science.fas.columbia.edu/news/refining-projections-of-antarctic-ice-loss-and-global-sea-level-rise/,"June 12, 2020",columbia_18
Maureen Raymo Appointed Interim Director of Lamont-Doherty Earth Observatory,https://science.fas.columbia.edu/news/maureen-raymo-appointed-interim-director-of-lamont-doherty-earth-observatory/,"June 11, 2020",columbia_19
Kriste Krstovski Uses Data Science to Transform Several Fields,https://science.fas.columbia.edu/news/kriste-krstovski-uses-data-science-to-transform-several-fields/,"June 11, 2020",columbia_20
The Collective Mind: Mathematical Model Reveals Key to Brain’s Unrivaled Computing Power,https://science.fas.columbia.edu/news/the-collective-mind-mathematical-model-reveals-key-to-brains-unrivaled-computing-power/,"June 9, 2020",columbia_21
What the Forecast for an Active Hurricane Season Means for the Atlantic Region,https://science.fas.columbia.edu/news/what-the-forecast-for-an-active-hurricane-season-means-for-the-atlantic-region/,"June 4, 2020",columbia_22
Ocean Uptake of CO2 Could Drop as We Cut Carbon Emissions,https://science.fas.columbia.edu/news/ocean-uptake-of-co2-could-drop-as-we-cut-carbon-emissions/,"June 3, 2020",columbia_23
Scientists Detect Crab Nebula Using Innovative Gamma-Ray Telescope,https://science.fas.columbia.edu/news/scientists-detect-crab-nebula-using-innovative-gamma-ray-telescope/,"June 1, 2020",columbia_24
Using Data Science to Transform K-12 STEM Education,https://science.fas.columbia.edu/news/using-data-science-to-transform-k-12-stem-education/,"June 1, 2020",columbia_25
Quantum Materials Researcher Receives $1.6 Million From the Gordon and Betty Moore Foundation,https://science.fas.columbia.edu/news/quantum-materials-researcher-receives-1-6-million-from-the-gordon-and-betty-moore-foundation/,"May 28, 2020",columbia_26
Statistical Tool Developed at Columbia Will Track Covid-19 Data as New York Emerges From Lockdown,https://science.fas.columbia.edu/news/statistical-tool-developed-at-columbia-will-track-covid-19-data-as-new-york-emerges-from-lockdown/,"May 26, 2020",columbia_27
Xiaomeng Jin Uses Satellite Imagery to Track Ozone Formation,https://science.fas.columbia.edu/news/xiaomeng-jin-uses-satellite-imagery-to-track-ozone-formation/,"May 22, 2020",columbia_28
The 12 Questions Earth Scientists Should Ask in the Next 10 Years,https://science.fas.columbia.edu/news/the-12-questions-earth-scientists-should-ask-in-the-next-10-years/,"May 22, 2020",columbia_29
Columbia’s Rafael Yuste Wins Vannevar Bush Fellowship,https://science.fas.columbia.edu/news/columbias-rafael-yuste-wins-vannevar-bush-fellowship/,"May 18, 2020",columbia_30
New Study Estimates the Odds of Life and Intelligence Emerging Beyond Our Planet,https://science.fas.columbia.edu/news/new-study-estimates-the-odds-of-life-and-intelligence-emerging-beyond-our-planet/,"May 18, 2020",columbia_31
A New Primer on Climate Change Science,https://science.fas.columbia.edu/news/a-new-primer-on-climate-change-science/,"May 14, 2020",columbia_32
Jeannette Wing Receives NSF Grant to Create COVID-19 Information Commons,https://science.fas.columbia.edu/news/jeannette-wing-receives-nsf-grant-to-create-covid-19-information-commons/,"May 11, 2020",columbia_33
Potentially Fatal Combinations of Humidity and Heat Are Emerging Across the Globe,https://science.fas.columbia.edu/news/potentially-fatal-combinations-of-humidity-and-heat-are-emerging-across-the-globe/,"May 8, 2020",columbia_34
How Does the Brain Link Events To Form A Memory?,https://science.fas.columbia.edu/news/how-does-the-brain-link-events-to-form-a-memory/,"May 8, 2020",columbia_35
Clay Layers and Distant Pumping Trigger Arsenic Contamination in Bangladesh Groundwater,https://science.fas.columbia.edu/news/clay-layers-and-distant-pumping-trigger-arsenic-contamination-in-bangladesh-groundwater/,"May 8, 2020",columbia_36
Max Topaz Uses Data Science to Help Nurses Care for Patients,https://science.fas.columbia.edu/news/max-topaz-uses-data-science-to-help-nurses-care-for-patients/,"May 5, 2020",columbia_37
Shrinking Snowcaps Fuel Harmful Algal Blooms in Arabian Sea,https://science.fas.columbia.edu/news/shrinking-snowcaps-fuel-harmful-algal-blooms-in-arabian-sea/,"May 4, 2020",columbia_38
Five Columbia Faculty Join the Ranks of the National Academy of Sciences,https://science.fas.columbia.edu/news/five-columbia-faculty-join-the-ranks-of-the-national-academy-of-sciences/,"May 2, 2020",columbia_39
Project Takes A New Approach to Gauging New York City’s Emissions,https://science.fas.columbia.edu/news/project-takes-a-new-approach-to-gauging-new-york-citys-emissions/,"April 28, 2020",columbia_40
The American Academy of Arts and Sciences Inducts 12 Columbia Faculty Members,https://science.fas.columbia.edu/news/the-american-academy-of-arts-and-sciences-inducts-12-columbia-faculty-members/,"April 27, 2020",columbia_41
Waterfront Development Added Billions to Property Values Exposed to Hurricane Florence,https://science.fas.columbia.edu/news/waterfront-development-added-billions-to-property-values-exposed-to-hurricane-florence/,"April 21, 2020",columbia_42
COVID19 Disruptions: Understanding Food Security Implications,https://science.fas.columbia.edu/news/covid19-disruptions-understanding-food-security-implications/,"April 20, 2020",columbia_43
"Early Exposure to Cannabis Boosts Young Brains’ Sensitivity to Cocaine, Rodent Study Suggests",https://science.fas.columbia.edu/news/early-exposure-to-cannabis-boosts-young-brains-sensitivity-to-cocaine-rodent-study-suggests/,"April 20, 2020",columbia_44
"Climate-Driven Megadrought Is Emerging in Western U.S., Says Study",https://science.fas.columbia.edu/news/climate-driven-megadrought-is-emerging-in-western-u-s-says-study/,"April 16, 2020",columbia_45
Finding the Brainy Genes That Make Us Human,https://science.fas.columbia.edu/news/finding-the-brainy-genes-that-make-us-human/,"April 16, 2020",columbia_46
Unusually Clear Skies Drove Record Loss of Greenland Ice in 2019,https://science.fas.columbia.edu/news/unusually-clear-skies-drove-record-loss-of-greenland-ice-in-2019/,"April 15, 2020",columbia_47
"How Advancing Glioma Cells Scramble Brain Function, Blood Flow",https://science.fas.columbia.edu/news/how-advancing-glioma-cells-scramble-brain-function-blood-flow/,"April 15, 2020",columbia_48
CovidWatcher App from Columbia University Tracks Coronavirus Hot Spots in NYC,https://science.fas.columbia.edu/news/covidwatcher-app-from-columbia-university-tracks-coronavirus-hot-spots-in-nyc/,"April 14, 2020",columbia_49
Precipitation Will Be Essential for Plants to Counteract Global Warming,https://science.fas.columbia.edu/news/precipitation-will-be-essential-for-plants-to-counteract-global-warming/,"April 14, 2020",columbia_50
Examining How Early Humans Responded to Climate Change,https://science.fas.columbia.edu/news/examining-how-early-humans-responded-to-climate-change/,"April 9, 2020",columbia_51
Making Sense of Scents: 3D Videos Reveal How the Nose Detects Odor Combinations,https://science.fas.columbia.edu/news/making-sense-of-scents-3d-videos-reveal-how-the-nose-detects-odor-combinations/,"April 9, 2020",columbia_52
ACToday Columbia World Project Enabling Insurance to Reach a Million Farmers in Ethiopia,https://science.fas.columbia.edu/news/actoday-columbia-world-project-enabling-insurance-to-reach-a-million-farmers-in-ethiopia/,"April 7, 2020",columbia_53
Oded Netzer on Making Sound Decisions During the Coronavirus Pandemic with Limited Data,https://science.fas.columbia.edu/news/oded-netzer-on-making-sound-decisions-during-the-coronavirus-pandemic-with-limited-data/,"April 2, 2020",columbia_54
American Robins Now Migrate 12 Days Earlier Than in 1994,https://science.fas.columbia.edu/news/american-robins-now-migrate-12-days-earlier-than-in-1994/,"April 1, 2020",columbia_55
"Columbia to Build Upgrades for Large Hadron Collider, the World’s Largest Atom Smasher",https://science.fas.columbia.edu/news/columbia-to-build-upgrades-for-large-hadron-collider-the-worlds-largest-atom-smasher/,"April 1, 2020",columbia_56
Ozone Treaty Stopped Jet-Stream Drift in Southern Hemisphere,https://science.fas.columbia.edu/news/ozone-treaty-stopped-jet-stream-drift-in-southern-hemisphere/,"March 27, 2020",columbia_57
"A Double-edged Sword: Scientists Identify Gene That Initially Slows, Then Later Accelerates, Disease Progression of ALS in Mice",https://science.fas.columbia.edu/news/a-double-edged-sword-scientists-identify-gene-that-initially-slows-then-later-accelerates-disease-progression-of-als-in-mice/,"March 27, 2020",columbia_58
What Can We Learn From Covid-19 to Help With Climate Change?,https://science.fas.columbia.edu/news/what-can-we-learn-from-covid-19-to-help-with-climate-change/,"March 26, 2020",columbia_59
Columbia Creates New Center to Combat Opioid Epidemic,https://science.fas.columbia.edu/news/columbia-creates-new-center-to-combat-opioid-epidemic/,"March 26, 2020",columbia_60
The Shutdown Is Clearing New York’s Air. Don’t Cheer Too Hard.,https://science.fas.columbia.edu/news/the-shutdown-is-clearing-new-yorks-air-dont-cheer-too-hard/,"March 25, 2020",columbia_61
Data for Good: Rafael Yuste on the Ethical Development of Neurotechnology,https://science.fas.columbia.edu/news/data-for-good-rafael-yuste-on-the-ethical-development-of-neurotechnology/,"March 23, 2020",columbia_62
Data Science Institute Alumni Use Machine Learning to Discover Coronavirus Treatments,https://science.fas.columbia.edu/news/data-science-institute-alumni-use-machine-learning-to-discover-coronavirus-treatments/,"March 19, 2020",columbia_63
Increasingly Mobile Sea Ice Means Arctic Neighbors May Pollute Each Others’ Waters,https://science.fas.columbia.edu/news/increasingly-mobile-sea-ice-means-arctic-neighbors-may-pollute-each-others-waters/,"March 18, 2020",columbia_64
"Even a Limited India-Pakistan Nuclear War Would Bring Global Famine, Says Study",https://science.fas.columbia.edu/news/even-a-limited-india-pakistan-nuclear-war-would-bring-global-famine-says-study/,"March 16, 2020",columbia_65
First Study to Relate Antarctic Sea Ice Melt to Weather Change in the Tropics,https://science.fas.columbia.edu/news/first-study-to-relate-antarctic-sea-ice-melt-to-weather-change-in-the-tropics/,"March 16, 2020",columbia_66
Study Suggests Shifts in Deep Geologic Structure May Have Magnified Great 2011 Japan Tsunami,https://science.fas.columbia.edu/news/study-suggests-shifts-in-deep-geologic-structure-may-have-magnified-great-2011-japan-tsunami/,"March 16, 2020",columbia_67
Curious Minds: How Do Flies See in Color?,https://science.fas.columbia.edu/news/curious-minds-how-do-flies-see-in-color/,"March 9, 2020",columbia_68
"Rain, More Than Wind, Led to Massive Toppling of Trees in Hurricane Maria, Says Study",https://science.fas.columbia.edu/news/rain-more-than-wind-led-to-massive-toppling-of-trees-in-hurricane-maria-says-study/,"March 9, 2020",columbia_69
Many Lyme Disease Cases Go Unreported. A New Model Could Help Change That.,https://science.fas.columbia.edu/news/many-lyme-disease-cases-go-unreported-a-new-model-could-help-change-that/,"March 5, 2020",columbia_70
International Women’s Day: Elizabeth Hillman’s Magic Microscopes,https://science.fas.columbia.edu/news/international-womens-day-elizabeth-hillmans-magic-microscopes/,"March 4, 2020",columbia_71
"Growing Nitrogen Footprint Threatens Our Air, Water and Climate",https://science.fas.columbia.edu/news/growing-nitrogen-footprint-threatens-our-air-water-and-climate/,"March 4, 2020",columbia_72
How Does the Brain Put Decisions into Context?,https://science.fas.columbia.edu/news/how-does-the-brain-put-decisions-into-context/,"February 26, 2020",columbia_73
Columbia Team Discovers New Way to Control the Phase of Light Using 2D Materials,https://science.fas.columbia.edu/news/columbia-team-discovers-new-way-to-control-the-phase-of-light-using-2d-materials/,"February 24, 2020",columbia_74
Columbia Researchers Develop New Method to Isolate Atomic Sheets and Create New Materials,https://science.fas.columbia.edu/news/columbia-researchers-develop-new-method-to-isolate-atomic-sheets-and-create-new-materials/,"February 20, 2020",columbia_75
Three Earth Institute Projects Make Top 100 Proposals for MacArthur $100 Million Grant,https://science.fas.columbia.edu/news/three-ei-projects-make-top-100-proposals-for-macarthur-100-million-grant/,"February 19, 2020",columbia_76
Curious Minds: Can You Inherit Stress on Your DNA?,https://science.fas.columbia.edu/news/curious-minds-can-you-inherit-stress-on-your-dna/,"February 19, 2020",columbia_77
"Columbia Initiatives Introduce Data Science to Teachers, K-12 Students",https://science.fas.columbia.edu/news/columbia-initiatives-introduce/,"February 18, 2020",columbia_78
"Focus on Food Would Help Solve Climate Change, Says Study",https://science.fas.columbia.edu/news/focus-on-food-would-help-solve-climate-change-says-study/,"February 18, 2020",columbia_79
How the Brain Makes Decisions Without Language,https://science.fas.columbia.edu/news/how-the-brain-makes-decisions-without-language/,"February 14, 2020",columbia_80
Using Big Data to Combat Catastrophes,https://science.fas.columbia.edu/news/using-big-data-to-combat-catastrophes/,"February 13, 2020",columbia_81
Curious Minds: How Do We Taste Sour?,https://science.fas.columbia.edu/news/curious-minds-how-do-we-taste-sour/,"February 12, 2020",columbia_82
Celebrating the International Day of Women and Girls in Science,https://science.fas.columbia.edu/news/celebrating-the-international-day-of-women-and-girls-in-science/,"February 11, 2020",columbia_83
"Toxic Protein, Linked to Alzheimer’s and Other Neurodegenerative Diseases, Exposed in New Detail",https://science.fas.columbia.edu/news/toxic-protein-linked-to-alzheimers-and-other-neurodegenerative-diseases-exposed-in-new-detail/,"February 6, 2020",columbia_84
Columbia’s Zuckerman Institute Announces Three Artists-in-Residence,https://science.fas.columbia.edu/news/columbias-zuckerman-institute-announces-three-artists-in-residence/,"February 4, 2020",columbia_85
Data Science Institute Research Team Wins Facebook Award to Enhance Machine Learning Models,https://science.fas.columbia.edu/news/data-science-institute-research-team-wins-facebook-award-to-enhance-machine-learning-models/,"February 2, 2020",columbia_86
Sex Pheromone Named for Jane Austen Character Alters Brain in Mouse Courtship,https://science.fas.columbia.edu/news/sex-pheromone-named-for-jane-austen-character-alters-brain-in-mouse-courtship/,"January 29, 2020",columbia_87
Wine Regions Could Shrink Dramatically With Climate Change Unless Growers Swap Varieties,https://science.fas.columbia.edu/news/wine-regions-could-shrink-dramatically-with-climate-change-unless-growers-swap-varieties/,"January 28, 2020",columbia_88
Mary Annaïse Heglar to Join Earth Institute as Writer-in-Residence,https://science.fas.columbia.edu/news/mary-annaise-heglar-to-join-earth-institute-as-writer-in-residence/,"January 27, 2020",columbia_89
Bridging the Air Pollution Data Gap in Sub-Saharan Africa,https://science.fas.columbia.edu/news/bridging-the-air-pollution-data-gap-in-sub-saharan-africa/,"January 23, 2020",columbia_90
Columbia Hosts Data Science and Public Health Summit,https://science.fas.columbia.edu/news/columbia-hosts-data-science-and-public-health-summit/,"January 21, 2020",columbia_91
"Ozone-Depleting Substances Caused Half of Late 20th-Century Arctic Warming, Says Study",https://science.fas.columbia.edu/news/ozone-depleting-substances-caused-half-of-late-20th-century-arctic-warming-says-study/,"January 20, 2020",columbia_92
"Rising Temperatures Will Mean More Fatal Injuries in the U.S., Says Study",https://science.fas.columbia.edu/news/rising-temperatures-will-mean-more-fatal-injuries-in-the-u-s-says-study/,"January 13, 2020",columbia_93
How Do Fruit Flies See in Color? Columbia Study Uncovers Human-like Brain Circuit at Work,https://science.fas.columbia.edu/news/how-do-fruit-flies-see-in-color-columbia-study-uncovers-human-like-brain-circuit-at-work/,"January 9, 2020",columbia_94
Mathematics and Neuroscience Merge to Shed Light on Learning,https://science.fas.columbia.edu/news/mathematics-and-neuroscience-merge-to-shed-light-on-learning/,"January 6, 2020",columbia_95
A Quantum Breakthrough Brings a Technique From Astronomy to the Nano-scale,https://science.fas.columbia.edu/news/a-quantum-breakthrough-brings-a-technique-from-astronomy-to-the-nano-scale/,"January 6, 2020",columbia_96
Curious Minds: How Can We See Living Nerve Cells in Action?,https://science.fas.columbia.edu/news/curious-minds-how-can-we-see-living-nerve-cells-in-action/,"December 18, 2019",columbia_97
"In Ancient Scottish Tree Rings, a Cautionary Tale on Climate, Politics and Survival",https://science.fas.columbia.edu/news/in-ancient-scottish-tree-rings-a-cautionary-tale-on-climate-politics-and-survival/,"December 17, 2019",columbia_98
Sailing Stone Track Discovered ‘Hiding in Plain Sight’ in Dinosaur Fossil,https://science.fas.columbia.edu/news/sailing-stone-track-discovered-hiding-in-plain-sight-in-dinosaur-fossil/,"December 9, 2019",columbia_99
Designing Smart Headphones That Warn Pedestrians of Imminent Dangers,https://science.fas.columbia.edu/news/designing-smart-headphones-that-warn-pedestrians-of-imminent-dangers/,"December 9, 2019",columbia_100
"Newly Identified Jet-Stream Pattern Could Imperil Global Food Supplies, Says Study",https://science.fas.columbia.edu/climate-response-news/newly-identified-jet-stream-pattern-could-imperil-global-food-supplies-says-study/,"December 9, 2019",columbia_101
"Within Sight of New York City, an Old-Growth Forest Faces Storms and Sea Level Rise",https://science.fas.columbia.edu/news/within-sight-of-new-york-city-an-old-growth-forest-faces-storms-and-sea-level-rise/,"December 3, 2019",columbia_102
"Less Rice, More Nutritious Crops Will Enhance India’s Food Supply, Study Says",https://science.fas.columbia.edu/news/less-rice-more-nutritious-crops-will-enhance-indias-food-supply-study-says/,"December 3, 2019",columbia_103
A New Theory for How Black Holes and Neutron Stars Shine Bright,https://science.fas.columbia.edu/news/a-new-theory-for-how-black-holes-and-neutron-stars-shine-bright/,"November 27, 2019",columbia_104
An Inlet By Any Other Name: Lamont Scientist Honored with Antarctic Namesake,https://science.fas.columbia.edu/news/an-inlet-by-any-other-name-lamont-scientist-honored-with-antarctic-namesake/,"November 27, 2019",columbia_105
Why Do We Freeze When Startled? New Study in Flies Points to Serotonin,https://science.fas.columbia.edu/news/why-do-we-freeze-when-startled-new-study-in-flies-points-to-serotonin/,"November 27, 2019",columbia_106
Assessing Landslide Risk in Rohingya Refugee Camps,https://science.fas.columbia.edu/news/assessing-landslide-risk-in-rohingya-refugee-camps/,"November 22, 2019",columbia_107
Curious Minds: How Do Birds Change Their Tune?,https://science.fas.columbia.edu/news/curious-minds-how-do-birds-change-their-tune/,"November 21, 2019",columbia_108
Music and the Mind: Award-Winning Pianist Reflects on Her Time as the Zuckerman Institute’s First Jazz Artist-in Residence,https://science.fas.columbia.edu/news/music-and-the-mind-award-winning-pianist-reflects-on-her-time-as-the-zuckerman-institutes-first-jazz-artist-in-residence/,"November 18, 2019",columbia_109
Recap: How Should Columbia Drive Climate Change Innovation?,https://science.fas.columbia.edu/news/recap-how-should-columbia-drive-climate-change-innovation/,"November 15, 2019",columbia_110
Linda Sohl Reconstructs Climate Models to Help the Search for Alien Life,https://science.fas.columbia.edu/news/linda-sohl-reconstructs-climate-models-to-help-the-search-for-alien-life/,"November 14, 2019",columbia_111
Why Being Bored Can Be Hazardous to Your Health,https://science.fas.columbia.edu/news/why-being-bored-can-be-hazardous-to-your-health/,"November 6, 2019",columbia_112
"As Climate Warms, Plants May Demand More Water, Cutting Supplies for People",https://science.fas.columbia.edu/news/as-climate-warms-plants-may-demand-more-water-cutting-supplies-for-people/,"November 4, 2019",columbia_113
Curious Minds: Why Do Some Memories Last a Lifetime?,https://science.fas.columbia.edu/news/curious-minds-why-do-some-memories-last-a-lifetime/,"October 31, 2019",columbia_114
Should New York Build a Storm Surge Barrier?,https://science.fas.columbia.edu/news/should-new-york-build-a-storm-surge-barrier/,"October 24, 2019",columbia_115
Zsuzsa Marka Helps Develop an Astrophysics Institute to Harness Cosmic Data,https://science.fas.columbia.edu/news/zsuzsa-marka-helps-develop-an-astrophysics-institute-to-harness-cosmic-data/,"October 24, 2019",columbia_116
The Brain Science of Baseball,https://science.fas.columbia.edu/news/the-brain-science-of-baseball/,"October 23, 2019",columbia_117
Northern Peatlands Contain Twice as Much Carbon as Previously Thought,https://science.fas.columbia.edu/news/northern-peatlands-contain-twice-as-much-carbon-as-previously-thought/,"October 21, 2019",columbia_118
How the Brain Dials Up the Volume to Hear Someone in a Crowd,https://science.fas.columbia.edu/news/how-the-brain-dials-up-the-volume-to-hear-someone-in-a-crowd/,"October 21, 2019",columbia_119
The Secret Life of Trees,https://science.fas.columbia.edu/news/the-secret-life-of-trees/,"October 16, 2019",columbia_120
Curious Minds: How Do We Make Everyday Decisions?,https://science.fas.columbia.edu/news/curious-minds-how-do-we-make-everyday-decisions/,"October 14, 2019",columbia_121
New Project Will Study Greenland’s Helheim Glacier in Unprecedented Detail,https://science.fas.columbia.edu/news/new-project-will-study-greenlands-helheim-glacier-in-unprecedented-detail/,"October 14, 2019",columbia_122
Columbia Scientists Reverse Core Symptom of Schizophrenia in Adult Mice,https://science.fas.columbia.edu/news/columbia-scientists-reverse-core-symptom-of-schizophrenia-in-adult-mice/,"October 9, 2019",columbia_123
