article_title,article_link,article_date,article_id
Physics meets the arts at Yale University Art Gallery,https://news.yale.edu/2019/05/13/physics-meets-arts-yale-university-art-gallery,"May 13, 2019",yale_298
Presidential update on Yale’s academic priorities,https://news.yale.edu/2019/05/09/presidential-update-yales-academic-priorities,"May 9, 2019",yale_299
Five faculty members honored with prizes for exceptional teaching,https://news.yale.edu/2019/05/08/five-faculty-members-honored-prizes-exceptional-teaching,"May 8, 2019",yale_300
New strategy for untreatable kidney disease: targeting cell energy,https://news.yale.edu/2019/05/07/new-strategy-untreatable-kidney-disease-targeting-cell-energy,"May 7, 2019",yale_301
Yale student joins alumni in supporting Connecticut’s youngest inventors,https://news.yale.edu/2019/05/07/yale-student-joins-alumni-supporting-connecticuts-youngest-inventors,"May 7, 2019",yale_302
Timothy Newhouse named a 2019 Camille Dreyfus Teacher-Scholar,https://news.yale.edu/2019/05/06/timothy-newhouse-named-2019-camille-dreyfus-teacher-scholar,"May 6, 2019",yale_303
What does Earth’s core have in common with salad dressing? Maybe this,https://news.yale.edu/2019/05/06/what-does-earths-core-have-common-salad-dressing-maybe,"May 6, 2019",yale_304
Many more amphibian species at risk of extinction than previously thought,https://news.yale.edu/2019/05/06/many-more-amphibian-species-risk-extinction-previously-thought,"May 6, 2019",yale_305
Ruzica Piskac wins Ackerman Award for Teaching and Mentoring,https://news.yale.edu/2019/05/03/ruzica-piskac-wins-ackerman-award-teaching-and-mentoring,"May 3, 2019",yale_306
Jack Harris wins Vannevar Bush Faculty Fellowship,https://news.yale.edu/2019/05/02/jack-harris-wins-vannevar-bush-faculty-fellowship,"May 2, 2019",yale_307
Single molecule puts sperm on track,https://news.yale.edu/2019/05/02/single-molecule-puts-sperm-track,"May 2, 2019",yale_308
Yale astronomer helps create ‘history book’ image of the universe,https://news.yale.edu/2019/05/02/yale-astronomer-helps-create-history-book-image-universe,"May 2, 2019",yale_309
"New material combines best of ceramics, metals, and plastics",https://news.yale.edu/2019/05/01/new-material-combines-best-ceramics-metals-and-plastics,"May 1, 2019",yale_310
"Contest connects artists, scientists in visualizing the mysterious neutrino",https://news.yale.edu/2019/05/01/contest-connects-artists-scientists-visualizing-mysterious-neutrino,"May 1, 2019",yale_311
Two Yale faculty honored by National Academy of Sciences,https://news.yale.edu/2019/04/30/two-yale-faculty-honored-national-academy-sciences,"April 30, 2019",yale_312
Magma is the key to the moon’s makeup,https://news.yale.edu/2019/04/29/magma-key-moons-makeup,"April 29, 2019",yale_313
New technique may improve detection and treatment of advanced brain cancer,https://news.yale.edu/2019/04/29/new-technique-may-improve-detection-and-treatment-advanced-brain-cancer,"April 29, 2019",yale_314
"For work with polymers, Mingjiang Zhong wins CAREER Award",https://news.yale.edu/2019/04/26/work-polymers-mingjiang-zhong-wins-career-award,"April 26, 2019",yale_315
"Meet Callichimaera perplexa, the platypus of crabs",https://news.yale.edu/2019/04/24/meet-callichimaera-perplexa-platypus-crabs,"April 24, 2019",yale_316
Ordering up another Science Happy Hour for April 23,https://news.yale.edu/2019/04/22/ordering-another-science-happy-hour-april-23,"April 22, 2019",yale_317
Behavioral disorders in kids with autism linked to lower brain connectivity,https://news.yale.edu/2019/04/18/behavioral-disorders-kids-autism-linked-lower-brain-connectivity,"April 18, 2019",yale_318
Yale chemists take a closer look at the spot where water meets air,https://news.yale.edu/2019/04/18/yale-chemists-take-closer-look-spot-where-water-meets-air,"April 18, 2019",yale_319
New experiment dives into quantum physics in a liquid,https://news.yale.edu/2019/04/18/new-experiment-dives-quantum-physics-liquid,"April 18, 2019",yale_320
Nine Yale faculty elected members of American Academy of Arts and Sciences,https://news.yale.edu/2019/04/17/nine-yale-faculty-elected-members-american-academy-arts-and-sciences,"April 17, 2019",yale_321
Scientists restore some functions in a pig’s brain hours after death,https://news.yale.edu/2019/04/17/scientists-restore-some-functions-pigs-brain-hours-after-death,"April 17, 2019",yale_322
Yale postdoctoral associate receives George Mercer Award,https://news.yale.edu/2019/04/16/yale-postdoctoral-associate-receives-george-mercer-award,"April 16, 2019",yale_323
Dept. of Energy grad student research award goes to London Cooper-Troendle,https://news.yale.edu/2019/04/15/dept-energy-grad-student-research-award-goes-london-cooper-troendle,"April 15, 2019",yale_324
Safeguards for human studies can’t cope with big data,https://news.yale.edu/2019/04/15/safeguards-human-studies-cant-cope-big-data,"April 15, 2019",yale_325
Three faculty members appointed to endowed chairs,https://news.yale.edu/2019/04/15/three-faculty-members-appointed-endowed-chairs,"April 15, 2019",yale_326
Scientist finds skin deep is very deep,https://news.yale.edu/2019/04/12/scientist-finds-skin-deep-very-deep,"April 12, 2019",yale_327
New study tracks fundamental movements in energy conversion,https://news.yale.edu/2019/04/12/new-study-tracks-fundamental-movements-energy-conversion,"April 12, 2019",yale_328
Yale’s Rakic receives Connecticut Medal of Science,https://news.yale.edu/2019/04/11/yales-rakic-receives-connecticut-medal-science,"April 11, 2019",yale_329
Brian Scassellati designated the Giamatti Professor of Computer Science,https://news.yale.edu/2019/04/11/brian-scassellati-designated-giamatti-professor-computer-science,"April 11, 2019",yale_330
Student-built device clears the way for surgeons,https://news.yale.edu/2019/04/11/student-built-device-clears-way-surgeons,"April 11, 2019",yale_331
Scientists find another way HIV can hide from vaccines,https://news.yale.edu/2019/04/10/scientists-find-another-way-hiv-can-hide-vaccines,"April 10, 2019",yale_332
The return of Cthulhu — the small sea critter,https://news.yale.edu/2019/04/09/return-cthulhu-small-sea-critter,"April 9, 2019",yale_333
Physics and Dance,https://news.yale.edu/2019/04/09/physics-and-dance,"April 9, 2019",yale_334
"At long last, a glimpse of a black hole",https://news.yale.edu/2019/04/09/long-last-glimpse-black-hole,"April 9, 2019",yale_335
New tool helps find genetic culprits in cancer’s spread,https://news.yale.edu/2019/04/08/new-tool-helps-find-genetic-culprits-cancers-spread,"April 8, 2019",yale_336
"In cellular world, strong relationships the key to healing old wounds",https://news.yale.edu/2019/04/08/cellular-world-strong-relationships-key-healing-old-wounds,"April 8, 2019",yale_337
Dr. Barbara Kazmierczak named the Pfeiffer M.D.-Ph.D. Program Director,https://news.yale.edu/2019/04/08/dr-barbara-kazmierczak-named-pfeiffer-md-phd-program-director,"April 8, 2019",yale_338
Bennett and Kazmierczak appointed to endowed chairs,https://news.yale.edu/2019/04/04/bennett-and-kazmierczak-appointed-endowed-chairs,"April 4, 2019",yale_339
Anton Bennett appointed the Duberg Professor of Pharmacology,https://news.yale.edu/2019/04/04/anton-bennett-appointed-duberg-professor-pharmacology,"April 4, 2019",yale_340
Bacterial nanowire mystery solved,https://news.yale.edu/2019/04/04/bacterial-nanowire-mystery-solved,"April 4, 2019",yale_341
Strolling on the lunar surface — with some help from a Yale professor,https://news.yale.edu/2019/04/03/strolling-lunar-surface-some-help-yale-professor,"April 3, 2019",yale_342
It’s a one-way street for sound waves in this new technology,https://news.yale.edu/2019/04/03/its-one-way-street-sound-waves-new-technology,"April 3, 2019",yale_343
Chun awarded prestigious 2019 Ho-Am Prize for Science,https://news.yale.edu/2019/04/03/chun-awarded-prestigious-2019-ho-am-prize-science,"April 3, 2019",yale_344
Geneticist Lesch is named a 2019 Searle Scholar,https://news.yale.edu/2019/04/02/geneticist-lesch-named-2019-searle-scholar,"April 2, 2019",yale_345
New studies confirm existence of galaxies with almost no dark matter,https://news.yale.edu/2019/03/29/new-studies-confirm-existence-galaxies-almost-no-dark-matter,"March 29, 2019",yale_346
All-female spacewalk is a ludicrous casualty of all-male assumptions,https://news.yale.edu/2019/03/28/all-female-spacewalk-ludicrous-casualty-all-male-assumptions,"March 28, 2019",yale_347
Engineered vessels evolve into living tissue,https://news.yale.edu/2019/03/27/engineered-vessels-evolve-living-tissue,"March 27, 2019",yale_348
Math — not computer science — was Grace Hopper’s first language,https://news.yale.edu/2019/03/26/math-not-computer-science-was-grace-hoppers-first-language,"March 26, 2019",yale_349
Blueprint: The Evolutionary Origins of a Good Society,https://news.yale.edu/2019/03/26/blueprint-evolutionary-origins-good-society,"March 26, 2019",yale_350
Yale undergrad team chosen by NASA to launch satellite to study cosmic rays,https://news.yale.edu/2019/03/25/yale-undergrad-team-chosen-nasa-launch-satellite-study-cosmic-rays,"March 25, 2019",yale_351
Scientists narrow in on cells that drive immune response to cancer,https://news.yale.edu/2019/03/20/scientists-narrow-cells-drive-immune-response-cancer,"March 20, 2019",yale_352
"Symposium honors Steitz, illuminates challenges that women scientists face",https://news.yale.edu/2019/03/19/symposium-honors-steitz-illuminates-challenges-women-scientists-face,"March 19, 2019",yale_353
Scientists discover mechanics of asthmatic bronchial spasm,https://news.yale.edu/2019/03/15/scientists-discover-mechanics-asthmatic-bronchial-spasm,"March 15, 2019",yale_354
Yale’s Horwich co-recipient of prestigious German science prize,https://news.yale.edu/2019/03/14/yales-horwich-co-recipient-prestigious-german-science-prize,"March 14, 2019",yale_355
Innovation Summit keynote: Yale is a preeminent lifescience research center,https://news.yale.edu/2019/03/14/innovation-summit-keynote-yale-preeminent-lifescience-research-center,"March 14, 2019",yale_356
Gut bacteria neutralizes disease-carrying tsetse flies,https://news.yale.edu/2019/03/14/gut-bacteria-neutralizes-disease-carrying-tsetse-flies,"March 14, 2019",yale_357
A new theory for ‘Oumuamua: It’s a comet that rocks,https://news.yale.edu/2019/03/12/new-theory-oumuamua-its-comet-rocks,"March 12, 2019",yale_358
Device that ‘shakes’ light a breakthrough in photonics,https://news.yale.edu/2019/03/11/device-shakes-light-breakthrough-photonics,"March 11, 2019",yale_359
Protection from Zika virus may lie in a protein derived from mosquitoes,https://news.yale.edu/2019/03/11/protection-zika-virus-may-lie-protein-derived-mosquitoes,"March 11, 2019",yale_360
Experts present a new framework for global species monitoring,https://news.yale.edu/2019/03/11/experts-present-new-framework-global-species-monitoring,"March 11, 2019",yale_361
Yale physicists light the way for new technology discoveries,https://news.yale.edu/2019/03/11/yale-physicists-light-way-new-technology-discoveries,"March 11, 2019",yale_362
"‘Specialized’ microbes within plant species promote diversity, study finds",https://news.yale.edu/2019/03/11/specialized-microbes-within-plant-species-promote-diversity-study-finds,"March 11, 2019",yale_363
Scientists show actin in action,https://news.yale.edu/2019/03/07/scientists-show-actin-action,"March 7, 2019",yale_364
Debra Fischer designated the Eugene Higgins Professor,https://news.yale.edu/2019/03/07/debra-fischer-designated-eugene-higgins-professor,"March 7, 2019",yale_365
Fischer and Lewis appointed to endowed chairs,https://news.yale.edu/2019/03/07/fischer-and-lewis-appointed-endowed-chairs,"March 7, 2019",yale_366
Elon Musk’s adventure in space,https://news.yale.edu/2019/03/06/elon-musks-adventure-space,"March 6, 2019",yale_367
Molecular clock influences immune cell responses,https://news.yale.edu/2019/03/05/molecular-clock-influences-immune-cell-responses,"March 5, 2019",yale_368
Single gene linked to host of abnormalities during neurodevelopment,https://news.yale.edu/2019/03/05/single-gene-linked-host-abnormalities-during-neurodevelopment,"March 5, 2019",yale_369
New shapes of laser beam ‘sneak’ through opaque media,https://news.yale.edu/2019/03/04/new-shapes-laser-beam-sneak-through-opaque-media,"March 4, 2019",yale_370
The case of the over-tilting exoplanets,https://news.yale.edu/2019/03/04/case-over-tilting-exoplanets,"March 4, 2019",yale_371
Two faculty members named as John C. Malone Professors,https://news.yale.edu/2019/03/04/two-faculty-members-named-john-c-malone-professors,"March 4, 2019",yale_372
Holly Rushmeier appointed the Malone Professor of Computer Science,https://news.yale.edu/2019/03/04/holly-rushmeier-appointed-malone-professor-computer-science,"March 4, 2019",yale_373
Hui Cao named the Malone Professor of Applied Physics and of Physics,https://news.yale.edu/2019/03/04/hui-cao-named-malone-professor-applied-physics-and-physics,"March 4, 2019",yale_374
Happy in marriage? Genetics may play a role,https://news.yale.edu/2019/02/28/happy-marriage-genetics-may-play-role,"February 28, 2019",yale_375
Yale researchers create a ‘universal entangler’ for new quantum tech,https://news.yale.edu/2019/02/27/yale-researchers-create-universal-entangler-new-quantum-tech,"February 27, 2019",yale_376
Yale researchers develop modular approach to engineering immune cells,https://news.yale.edu/2019/02/25/yale-researchers-develop-modular-approach-engineering-immune-cells,"February 25, 2019",yale_377
First Yale Instrumentation Lunch held at Wright Laboratory,https://news.yale.edu/2019/02/25/first-yale-instrumentation-lunch-held-wright-laboratory,"February 25, 2019",yale_378
"Liquid has structure, which may be key to understanding metallic glass",https://news.yale.edu/2019/02/22/liquid-has-structure-which-may-be-key-understanding-metallic-glass,"February 22, 2019",yale_379
Researchers create organoid of a brain region to study cognitive disorders,https://news.yale.edu/2019/02/21/researchers-create-organoid-brain-region-study-cognitive-disorders,"February 21, 2019",yale_380
Yale faculty honored by Connecticut Academy of Science and Engineering,https://news.yale.edu/2019/02/20/yale-faculty-honored-connecticut-academy-science-and-engineering,"February 20, 2019",yale_381
The physics of Jackson Pollock and Helen Frankenthaler,https://news.yale.edu/2019/02/20/physics-jackson-pollock-and-helen-frankenthaler,"February 20, 2019",yale_382
Yale faculty members awarded prestigious 2019 Sloan Research Fellowships,https://news.yale.edu/2019/02/19/yale-faculty-members-awarded-prestigious-2019-sloan-research-fellowships,"February 19, 2019",yale_383
Study finds wide variation between human cell lines used for research,https://news.yale.edu/2019/02/18/study-finds-wide-variation-between-human-cell-lines-used-research,"February 18, 2019",yale_384
Hear some quantum noise during sound artist’s talk,https://news.yale.edu/2019/02/14/hear-some-quantum-noise-during-sound-artists-talk,"February 14, 2019",yale_385
Improved RNA data visualization method gets to the bigger picture faster,https://news.yale.edu/2019/02/14/improved-rna-data-visualization-method-gets-bigger-picture-faster,"February 14, 2019",yale_386
"With NASA grant, new project seeks to replicate the Cradle of Life",https://news.yale.edu/2019/02/14/nasa-grant-new-project-seeks-replicate-cradle-life,"February 14, 2019",yale_387
The role of the rolling jaw in early mammals,https://news.yale.edu/2019/02/13/role-rolling-jaw-early-mammals,"February 13, 2019",yale_388
PREP program makes talented students even stronger doctoral candidates,https://news.yale.edu/2019/02/13/prep-program-makes-talented-students-even-stronger-doctoral-candidates,"February 13, 2019",yale_389
"Students hone engineering, teamwork skills by tackling real-world projects",https://news.yale.edu/2019/02/12/students-hone-engineering-teamwork-skills-tackling-real-world-projects,"February 12, 2019",yale_390
Study: Clues to how cells and tissues maintain their shape,https://news.yale.edu/2019/02/11/study-clues-how-cells-and-tissues-maintain-their-shape,"February 11, 2019",yale_391
Scientists stumble upon a model to study a lethal complication,https://news.yale.edu/2019/02/08/scientists-stumble-upon-model-study-lethal-complication,"February 8, 2019",yale_392
Equity in the Job Search Symposium to explore gender bias in STEM hiring,https://news.yale.edu/2019/02/08/equity-job-search-symposium-explore-gender-bias-stem-hiring,"February 8, 2019",yale_393
Local variations in circuitry are key to brain’s power,https://news.yale.edu/2019/02/08/local-variations-circuitry-are-key-brains-power,"February 8, 2019",yale_394
Microbiome could be culprit when good drugs do harm,https://news.yale.edu/2019/02/07/microbiome-could-be-culprit-when-good-drugs-do-harm,"February 7, 2019",yale_395
"Ion beam arrives at West Campus, gives researchers new possibilities",https://news.yale.edu/2019/02/06/ion-beam-arrives-west-campus-gives-researchers-new-possibilities,"February 6, 2019",yale_396
A Yale astrophysicist’s prediction comes to pass — 20 years later,https://news.yale.edu/2019/02/04/yale-astrophysicists-prediction-comes-pass-20-years-later,"February 4, 2019",yale_397
"In cell replication, information is thermodynamic power",https://news.yale.edu/2019/02/01/cell-replication-information-thermodynamic-power,"February 1, 2019",yale_398
What the NFL can tell us about longevity: There’s no need to act your age,https://news.yale.edu/2019/01/31/what-nfl-can-tell-us-about-longevity-theres-no-need-act-your-age,"January 31, 2019",yale_399
From Yale to data science: How one alum made the leap,https://news.yale.edu/2019/01/30/yale-data-science-how-one-alum-made-leap,"January 30, 2019",yale_400
Retaining non-traditional students in STEM classrooms,https://news.yale.edu/2019/01/28/retaining-non-traditional-students-stem-classrooms,"January 28, 2019",yale_401
Yale quantum computing startup Quantum Circuits Inc. opens lab in New Haven,https://news.yale.edu/2019/01/24/yale-quantum-computing-startup-quantum-circuits-inc-opens-lab-new-haven,"January 24, 2019",yale_402
This galaxy is no match for a hungry cluster,https://news.yale.edu/2019/01/24/galaxy-no-match-hungry-cluster,"January 24, 2019",yale_403
Yale faculty at Davos explore the state of mind that is happiness,https://news.yale.edu/2019/01/22/yale-faculty-davos-explore-state-mind-happiness,"January 22, 2019",yale_404
Yale lab receives gift to develop virtual reality tools,https://news.yale.edu/2019/01/22/yale-lab-receives-gift-develop-virtual-reality-tools,"January 22, 2019",yale_405
Yale scientists examine how an immune system protein helps suppress HIV,https://news.yale.edu/2019/01/21/yale-scientists-examine-how-immune-system-protein-helps-suppress-hiv,"January 21, 2019",yale_406
Data science students get a sampling of potential research areas,https://news.yale.edu/2019/01/17/data-science-students-get-sampling-potential-research-areas,"January 17, 2019",yale_407
Physics and Dance,https://news.yale.edu/2019/01/16/physics-and-dance,"January 16, 2019",yale_408
Principles of Secure Processor Architecture Design,https://news.yale.edu/2019/01/15/principles-secure-processor-architecture-design,"January 15, 2019",yale_409
Research reveals strategies for combating science misinformation,https://news.yale.edu/2019/01/14/research-reveals-strategies-combating-science-misinformation,"January 14, 2019",yale_410
Innovative technology offers new insights into RNA,https://news.yale.edu/2019/01/11/innovative-technology-offers-new-insights-rna,"January 11, 2019",yale_411
Yale researchers track the birth of memories,https://news.yale.edu/2019/01/10/yale-researchers-track-birth-memories,"January 10, 2019",yale_412
Astronomers uncover the brightest quasar in the early universe,https://news.yale.edu/2019/01/09/astronomers-uncover-brightest-quasar-early-universe,"January 9, 2019",yale_413
CHIME telescope detects second repeating fast radio burst from other galaxy,https://news.yale.edu/2019/01/09/chime-telescope-detects-second-repeating-fast-radio-burst-other-galaxy,"January 9, 2019",yale_414
Neural fingerprints ID those likely to abstain from cocaine,https://news.yale.edu/2019/01/04/neural-fingerprints-id-those-likely-abstain-cocaine,"January 4, 2019",yale_415
Yale scientists open up new world for biologics — inside the cell,https://news.yale.edu/2019/01/04/yale-scientists-open-new-world-biologics-inside-cell,"January 4, 2019",yale_416
Web application shares ‘Science Stories’ of pioneering women at Yale,https://news.yale.edu/2019/01/03/web-application-shares-science-stories-pioneering-women-yale,"January 3, 2019",yale_417
How do hair follicles grow? A Yale-led study untangles the science,https://news.yale.edu/2018/12/27/how-do-hair-follicles-grow-yale-led-study-untangles-science,"December 27, 2018",yale_418
Four faculty members win cash prizes at OCR’s Pitchfest,https://news.yale.edu/2018/12/20/four-faculty-members-win-cash-prizes-ocrs-pitchfest,"December 20, 2018",yale_419
YaleNews looks back on 2018,https://news.yale.edu/2018/12/19/yalenews-looks-back-2018,"December 19, 2018",yale_420
Yale scientists zero in on a cause of deadly brain bleeds in babies,https://news.yale.edu/2018/12/18/yale-scientists-zero-cause-deadly-brain-bleeds-babies,"December 18, 2018",yale_421
President Salovey cuts ribbon for Brain Imaging Center using only his mind,https://news.yale.edu/2018/12/18/president-salovey-cuts-ribbon-brain-imaging-center-using-only-his-mind,"December 18, 2018",yale_422
Synthesizing natural products with a computational step saver,https://news.yale.edu/2018/12/18/synthesizing-natural-products-computational-step-saver,"December 18, 2018",yale_423
Geologist David Evans draws new roadmaps for ancient continents,https://news.yale.edu/2018/12/17/geologist-david-evans-draws-new-roadmaps-ancient-continents,"December 17, 2018",yale_424
Gene variant found in brain complicit in MS onset,https://news.yale.edu/2018/12/17/gene-variant-found-brain-complicit-ms-onset,"December 17, 2018",yale_425
Adaptive Phage Therapeutics to collaborate with Yale’s Paul Turner Lab,https://news.yale.edu/2018/12/13/adaptive-phage-therapeutics-collaborate-yales-paul-turner-lab,"December 13, 2018",yale_426
A global effort,https://news.yale.edu/2018/12/13/global-effort,"December 13, 2018",yale_427
"In the developing brain, scientists find roots of neuropsychiatric diseases",https://news.yale.edu/2018/12/13/developing-brain-scientists-find-roots-neuropsychiatric-diseases,"December 13, 2018",yale_428
Exploring the cutting edge of quantum science at Yale,https://news.yale.edu/in-focus/exploring-cutting-edge-quantum-science-yale,"December 12, 2018",yale_429
Yale scientists study genes misidentified as  ‘non-protein coding’,https://news.yale.edu/2018/12/12/yale-scientists-study-genes-misidentified-non-protein-coding,"December 12, 2018",yale_430
Better living through algorithms,https://news.yale.edu/2018/12/12/better-living-through-algorithms,"December 12, 2018",yale_431
A better look at how cells move,https://news.yale.edu/2018/12/11/better-look-how-cells-move,"December 11, 2018",yale_432
Yale chemists find a new tool for understanding enzymes — Google,https://news.yale.edu/2018/12/11/yale-chemists-find-new-tool-understanding-enzymes-google,"December 11, 2018",yale_433
Importance of microbes focus of Yale Microbial Sciences Institute retreat,https://news.yale.edu/2018/12/10/importance-microbes-focus-yale-microbial-sciences-institute-retreat,"December 10, 2018",yale_434
Marcia Johnson wins Benjamin Franklin Medal for memory research,https://news.yale.edu/2018/12/10/marcia-johnson-wins-benjamin-franklin-medal-memory-research,"December 10, 2018",yale_435
Why take YData? Because data science shouldn’t be a ‘black box’,https://news.yale.edu/2018/12/10/why-take-ydata-because-data-science-shouldnt-be-black-box,"December 10, 2018",yale_436
A world of information at the Yale Day of Data,https://news.yale.edu/2018/12/06/world-information-yale-day-data,"December 6, 2018",yale_437
COSINE-100 experiment investigates dark matter mystery,https://news.yale.edu/2018/12/05/cosine-100-experiment-investigates-dark-matter-mystery,"December 5, 2018",yale_438
Schiffer announces next steps in advancing key science priorities at Yale,https://news.yale.edu/2018/12/04/schiffer-announces-next-steps-advancing-key-science-priorities-yale,"December 4, 2018",yale_439
Mountain splendor? Scientists know where your eyes will look,https://news.yale.edu/2018/12/04/mountain-splendor-scientists-know-where-your-eyes-will-look,"December 4, 2018",yale_440
Science journalist Margonelli to discuss ‘Small Termites and Big Ideas’,https://news.yale.edu/2018/12/03/science-journalist-margonelli-discuss-small-termites-and-big-ideas,"December 3, 2018",yale_441
Yale scientists make a borophene breakthrough,https://news.yale.edu/2018/12/03/yale-scientists-make-borophene-breakthrough,"December 3, 2018",yale_442
"In death, Lonesome George reveals why giant tortoises live so long",https://news.yale.edu/2018/12/03/death-lonesome-george-reveals-why-giant-tortoises-live-so-long,"December 3, 2018",yale_443
Office of Cooperative Research announces 2018 Pitchfest participants,https://news.yale.edu/2018/12/03/office-cooperative-research-announces-2018-pitchfest-participants,"December 3, 2018",yale_444
President’s response to the University Science Strategy Committee’s report,https://news.yale.edu/2018/11/28/presidents-response-university-science-strategy-committees-report,"November 28, 2018",yale_445
Making sound ‘chill out’,https://news.yale.edu/2018/11/27/making-sound-chill-out,"November 27, 2018",yale_446
Four Yale faculty members named AAAS Fellows,https://news.yale.edu/2018/11/27/four-yale-faculty-members-named-aaas-fellows,"November 27, 2018",yale_447
