article_title,article_link,article_date,article_id
The science of membranes’ gatekeeping abilities,https://news.yale.edu/2020/01/23/science-membranes-gatekeeping-abilities,"January 23, 2020",yale_150
Innovation award showcases strength of YSPH modeling unit,https://news.yale.edu/2020/01/23/innovation-award-showcases-strength-ysph-modeling-unit,"January 23, 2020",yale_151
John Tully and Richard Aslin honored with 2020 NAS awards,https://news.yale.edu/2020/01/22/john-tully-and-richard-aslin-honored-2020-nas-awards,"January 22, 2020",yale_152
"In death of dinosaurs, it was all about the asteroid — not volcanoes",https://news.yale.edu/2020/01/16/death-dinosaurs-it-was-all-about-asteroid-not-volcanoes,"January 16, 2020",yale_153
Latest tech in clinical grafts? A ‘universal’ blood vessel,https://news.yale.edu/2020/01/16/latest-tech-clinical-grafts-universal-blood-vessel,"January 16, 2020",yale_154
Collision helped make the Milky Way — and now we know when,https://news.yale.edu/2020/01/13/collision-helped-make-milky-way-and-now-we-know-when,"January 13, 2020",yale_155
The many lives of Triceratops skull No. 21,https://news.yale.edu/2020/01/13/many-lives-triceratops-skull-no-21,"January 13, 2020",yale_156
Molecular ‘doormen’ open the way to potential obesity treatment,https://news.yale.edu/2020/01/10/molecular-doormen-open-way-potential-obesity-treatment,"January 10, 2020",yale_157
"In fighting gut infections, nervous system is key, Yale-Harvard team finds",https://news.yale.edu/2020/01/09/fighting-gut-infections-nervous-system-key-yale-harvard-team-finds,"January 9, 2020",yale_158
The top YaleNews stories of 2019,https://news.yale.edu/2019/12/19/top-yalenews-stories-2019,"December 19, 2019",yale_159
Machine learning helps tame a sea of plankton species data,https://news.yale.edu/2019/12/18/machine-learning-helps-tame-sea-plankton-species-data,"December 18, 2019",yale_160
Nature honors Yale’s Sestan for reviving pigs’ brain function after death,https://news.yale.edu/2019/12/17/nature-honors-yales-sestan-reviving-pigs-brain-function-after-death,"December 17, 2019",yale_161
Nisheeth Vishnoi honored by Association for Computing Machinery,https://news.yale.edu/2019/12/13/nisheeth-vishnoi-honored-association-computing-machinery,"December 13, 2019",yale_162
"‘Portraits of a Planet’ — astronaut’s Yale exhibition blends art, science",https://news.yale.edu/2019/12/09/portraits-planet-astronauts-yale-exhibition-blends-art-science,"December 9, 2019",yale_163
Podcast: The potential for science & religion to unite on climate fight,https://news.yale.edu/2019/12/06/podcast-potential-science-religion-unite-climate-fight,"December 6, 2019",yale_164
PHATED to be: Yale researchers give shape to big data,https://news.yale.edu/2019/12/05/phated-be-yale-researchers-give-shape-big-data,"December 5, 2019",yale_165
"With cellular blueprint for lungs, researchers look to organ regeneration",https://news.yale.edu/2019/12/04/cellular-blueprint-lungs-researchers-look-organ-regeneration,"December 4, 2019",yale_166
Untangling the branches in the mammal tree of life,https://news.yale.edu/2019/12/04/untangling-branches-mammal-tree-life,"December 4, 2019",yale_167
An electron highway headed for methanol,https://news.yale.edu/2019/11/27/electron-highway-headed-methanol,"November 27, 2019",yale_168
World’s oldest comma shrimp was way ahead of the curve,https://news.yale.edu/2019/11/26/worlds-oldest-comma-shrimp-was-way-ahead-curve,"November 26, 2019",yale_169
New image offers close-up view of interstellar comet,https://news.yale.edu/2019/11/26/new-image-offers-close-view-interstellar-comet,"November 26, 2019",yale_170
Linkage between evolution of pregnancy and cancer spread explained,https://news.yale.edu/2019/11/26/linkage-between-evolution-pregnancy-and-cancer-spread-explained,"November 26, 2019",yale_171
Kline renovation will mark ‘re-envisioning of how we work on Science Hill’,https://news.yale.edu/2019/11/20/kline-renovation-will-mark-re-envisioning-how-we-work-science-hill,"November 20, 2019",yale_172
Jeffrey Brock appointed the Zhao and Ji Professor of Mathematics,https://news.yale.edu/2019/11/20/jeffrey-brock-appointed-zhao-and-ji-professor-mathematics,"November 20, 2019",yale_173
Ketogenic diet helps tame flu virus,https://news.yale.edu/2019/11/15/ketogenic-diet-helps-tame-flu-virus,"November 15, 2019",yale_174
Yale’s Horwich among researchers honored at ‘Oscars of Science’,https://news.yale.edu/2019/11/06/yales-horwich-among-researchers-honored-oscars-science,"November 6, 2019",yale_175
Elisa Celis and the fight for fairness in artificial intelligence,https://news.yale.edu/2019/11/06/elisa-celis-and-fight-fairness-artificial-intelligence,"November 6, 2019",yale_176
Yale scientists capture dynamic brain in action,https://news.yale.edu/2019/11/04/yale-scientists-capture-dynamic-brain-action,"November 4, 2019",yale_177
Gordon Shepherd honored with Discovery Award,https://news.yale.edu/2019/11/01/gordon-shepherd-honored-discovery-award,"November 1, 2019",yale_178
Haskins Lab’s Philip Rubin named president-elect of science federation,https://news.yale.edu/2019/11/01/haskins-labs-philip-rubin-named-president-elect-science-federation,"November 1, 2019",yale_179
"Yale Science Building opens, signaling new era for Science Hill",https://news.yale.edu/2019/10/30/yale-science-building-opens-signaling-new-era-science-hill,"October 30, 2019",yale_180
President Salovey’s remarks at the dedication of the Yale Science Building,https://news.yale.edu/2019/10/29/president-saloveys-remarks-dedication-yale-science-building,"October 29, 2019",yale_181
Today: Celebrate the new Yale Science Building,https://news.yale.edu/2019/10/28/today-celebrate-new-yale-science-building,"October 28, 2019",yale_182
Editing mosquito’s gene wards off malaria and halts reproduction,https://news.yale.edu/2019/10/28/editing-mosquitos-gene-wards-malaria-and-halts-reproduction,"October 28, 2019",yale_183
Yale researchers find cells linked to leading cause of blindness in elderly,https://news.yale.edu/2019/10/24/yale-researchers-find-cells-linked-leading-cause-blindness-elderly,"October 24, 2019",yale_184
Yale scientists visualize pain’s pathway,https://news.yale.edu/2019/10/23/yale-scientists-visualize-pains-pathway,"October 23, 2019",yale_185
Mystery solved: ocean acidity in the last mass extinction,https://news.yale.edu/2019/10/21/mystery-solved-ocean-acidity-last-mass-extinction,"October 21, 2019",yale_186
"It takes two — a two-atom catalyst, that is — to make oxygen from water",https://news.yale.edu/2019/10/21/it-takes-two-two-atom-catalyst-make-oxygen-water,"October 21, 2019",yale_187
Yale Cancer Center builds research platform to help treat cervical cancer,https://news.yale.edu/2019/10/18/yale-cancer-center-builds-research-platform-help-treat-cervical-cancer,"October 18, 2019",yale_188
Molecular control of neurotransmitter linked to autism described,https://news.yale.edu/2019/10/15/molecular-control-neurotransmitter-linked-autism-described,"October 15, 2019",yale_189
Alvaro Sanchez awarded Packard Fellowship for work on microorganisms,https://news.yale.edu/2019/10/14/alvaro-sanchez-awarded-packard-fellowship-work-microorganisms,"October 14, 2019",yale_190
Yale scientists help immune system find hidden cancer cells,https://news.yale.edu/2019/10/14/yale-scientists-help-immune-system-find-hidden-cancer-cells,"October 14, 2019",yale_191
Nobel laureate John Goodenough ’44 inspires next generation of scientists,https://news.yale.edu/2019/10/09/nobel-laureate-john-goodenough-44-inspires-next-generation-scientists,"October 9, 2019",yale_192
"Yale to co-host conference in Spain about creativity, emotion, and the arts",https://news.yale.edu/2019/10/08/yale-co-host-conference-spain-about-creativity-emotion-and-arts,"October 8, 2019",yale_193
Food critics to discuss podcasting about the science and history of food,https://news.yale.edu/2019/10/08/food-critics-discuss-podcasting-about-science-and-history-food,"October 8, 2019",yale_194
Researchers use AI to find patterns among multitude of people and cells,https://news.yale.edu/2019/10/08/researchers-use-ai-find-patterns-among-multitude-people-and-cells,"October 8, 2019",yale_195
Yale researchers develop way to help brain organoids thrive,https://news.yale.edu/2019/10/07/yale-researchers-develop-way-help-brain-organoids-thrive,"October 7, 2019",yale_196
‘Picoscience’ and a plethora of new materials,https://news.yale.edu/2019/10/07/picoscience-and-plethora-new-materials,"October 7, 2019",yale_197
Peabody after-school program for local students awarded Avangrid grant,https://news.yale.edu/2019/10/03/peabody-after-school-program-local-students-awarded-avangrid-grant,"October 3, 2019",yale_198
Female orgasm is evolution’s happy gift,https://news.yale.edu/2019/09/30/female-orgasm-evolutions-happy-gift,"September 30, 2019",yale_199
Growing old together: a sharper look at black holes and their host galaxies,https://news.yale.edu/2019/09/30/growing-old-together-sharper-look-black-holes-and-their-host-galaxies,"September 30, 2019",yale_200
Molecular memories are made of this,https://news.yale.edu/2019/09/27/molecular-memories-are-made,"September 27, 2019",yale_201
"Get ready for more interstellar objects, Yale astronomers say",https://news.yale.edu/2019/09/26/get-ready-more-interstellar-objects-yale-astronomers-say,"September 26, 2019",yale_202
Neeley and Yong extol the power of narrative in science writing,https://news.yale.edu/2019/09/25/neeley-and-yong-extol-power-narrative-science-writing,"September 25, 2019",yale_203
Yale researchers identify rare inherited immune disease,https://news.yale.edu/2019/09/25/yale-researchers-identify-rare-inherited-immune-disease,"September 25, 2019",yale_204
Yale invests in core facilities,https://news.yale.edu/2019/09/24/yale-invests-core-facilities,"September 24, 2019",yale_205
Mammals’ enhanced capacity to see emerges early in development,https://news.yale.edu/2019/09/24/mammals-enhanced-capacity-see-emerges-early-development,"September 24, 2019",yale_206
Yale researchers use immune system to attack glioblastoma,https://news.yale.edu/2019/09/24/yale-researchers-use-immune-system-attack-glioblastoma,"September 24, 2019",yale_207
Science journalists to discuss why storytelling matters for science,https://news.yale.edu/2019/09/19/science-journalists-discuss-why-storytelling-matters-science-0,"September 19, 2019",yale_208
Study: Musculoskeletal urgent care centers restrict Medicaid patients,https://news.yale.edu/2019/09/18/study-musculoskeletal-urgent-care-centers-restrict-medicaid-patients,"September 18, 2019",yale_209
Atlantic Ocean may get a jump start from the other side of the world,https://news.yale.edu/2019/09/16/atlantic-ocean-may-get-jump-start-other-side-world,"September 16, 2019",yale_210
Yale launches comprehensive DNA sequencing project,https://news.yale.edu/2019/09/12/yale-launches-comprehensive-dna-sequencing-project,"September 12, 2019",yale_211
Yale researchers named Hanna Gray Fellows at HHMI,https://news.yale.edu/2019/09/12/yale-researchers-named-hanna-gray-fellows-hhmi,"September 12, 2019",yale_212
Molecular ‘fossils’ help explain key evolutionary event,https://news.yale.edu/2019/09/11/molecular-fossils-help-explain-key-evolutionary-event,"September 11, 2019",yale_213
Skeletons yield clues about 19th-century immigrant life in New Haven,https://news.yale.edu/2019/09/09/skeletons-yield-clues-about-19th-century-immigrant-life-new-haven,"September 9, 2019",yale_214
"High-fat diets affect your brain, not just your physical appearance",https://news.yale.edu/2019/09/05/high-fat-diets-affect-your-brain-not-just-your-physical-appearance,"September 5, 2019",yale_215
Yale’s Horwich co-recipient of $3 million Breakthrough Prize,https://news.yale.edu/2019/09/05/yales-horwich-co-recipient-3-million-breakthrough-prize,"September 5, 2019",yale_216
New hair follicles can corral skin cancer,https://news.yale.edu/2019/09/05/new-hair-follicles-can-corral-skin-cancer,"September 5, 2019",yale_217
Study reaches multidisciplinary consensus on imaging for kidney stones,https://news.yale.edu/2019/09/03/study-reaches-multidisciplinary-consensus-imaging-kidney-stones,"September 3, 2019",yale_218
Yale researchers find new cancer gene drivers,https://news.yale.edu/2019/09/03/yale-researchers-find-new-cancer-gene-drivers,"September 3, 2019",yale_219
Creativity in motion: how Yale engineering puts theory to practice,https://news.yale.edu/in-focus/creativity-motion-how-yale-engineering-puts-theory-practice,"August 28, 2019",yale_220
"Brian Skinner, world-renowned geologist, beloved teacher",https://news.yale.edu/2019/08/28/brian-skinner-world-renowned-geologist-beloved-teacher,"August 28, 2019",yale_221
"At Yale Science Building, a move-in as big as the research to come",https://news.yale.edu/2019/08/27/yale-science-building-move-big-research-come,"August 27, 2019",yale_222
Talk to consider ‘What happens when we start engineering the wild?’,https://news.yale.edu/2019/08/26/talk-consider-what-happens-when-we-start-engineering-wild,"August 26, 2019",yale_223
Lu and Sestan appointed to endowed chairs,https://news.yale.edu/2019/08/22/lu-and-sestan-appointed-endowed-chairs,"August 22, 2019",yale_224
Dr. Nenad Sestan appointed the Cushing Professor of Neuroscience,https://news.yale.edu/2019/08/22/dr-nenad-sestan-appointed-cushing-professor-neuroscience,"August 22, 2019",yale_225
Genome screen uncovers new targets for cancer immunotherapy,https://news.yale.edu/2019/08/22/genome-screen-uncovers-new-targets-cancer-immunotherapy,"August 22, 2019",yale_226
How plants know the difference between night and day,https://news.yale.edu/2019/08/21/how-plants-know-difference-between-night-and-day,"August 21, 2019",yale_227
Researchers show how age can damage DNA,https://news.yale.edu/2019/08/20/researchers-show-how-age-can-damage-dna,"August 20, 2019",yale_228
How do humans survive infections? Study pinpoints the role of a key hormone,https://news.yale.edu/2019/08/19/how-do-humans-survive-infections-study-pinpoints-role-key-hormone,"August 19, 2019",yale_229
Victor Batista named the Huffman Professor of Chemistry,https://news.yale.edu/2019/08/15/victor-batista-named-huffman-professor-chemistry,"August 15, 2019",yale_230
Batista and Szabó appointed to endowed chairs,https://news.yale.edu/2019/08/15/batista-and-szabo-appointed-endowed-chairs,"August 15, 2019",yale_231
Researchers describe building blocks of HIV’s protective shell,https://news.yale.edu/2019/08/14/researchers-describe-building-blocks-hivs-protective-shell,"August 14, 2019",yale_232
REVU puts ‘boots on the ground’ to get vets research experience,https://news.yale.edu/2019/08/13/revu-puts-boots-ground-get-vets-research-experience,"August 13, 2019",yale_233
Finding a cosmic fog within shattered intergalactic ‘pancakes’,https://news.yale.edu/2019/08/13/finding-cosmic-fog-within-shattered-intergalactic-pancakes,"August 13, 2019",yale_234
Haskins builds bridges between scientists and educators at Summer Institute,https://news.yale.edu/2019/08/12/haskins-builds-bridges-between-scientists-and-educators-summer-institute,"August 12, 2019",yale_235
Yale scientists zero in on atomic driver of tumor formation,https://news.yale.edu/2019/08/09/yale-scientists-zero-atomic-driver-tumor-formation,"August 9, 2019",yale_236
Julie Dorsey designated the Beinecke Professor of Computer Science,https://news.yale.edu/2019/08/05/julie-dorsey-designated-beinecke-professor-computer-science,"August 5, 2019",yale_237
Peter Schiffer named the Beinecke Professor of Applied Physics,https://news.yale.edu/2019/08/05/peter-schiffer-named-beinecke-professor-applied-physics,"August 5, 2019",yale_238
Richard Kenyon appointed the DeForest Professor of Mathematics,https://news.yale.edu/2019/08/05/richard-kenyon-appointed-deforest-professor-mathematics,"August 5, 2019",yale_239
Ruzica Piskac named the Dubinsky Associate Professor of Computer Science,https://news.yale.edu/2019/08/05/ruzica-piskac-named-dubinsky-associate-professor-computer-science,"August 5, 2019",yale_240
Four faculty members appointed to endowed chairs,https://news.yale.edu/2019/08/01/four-faculty-members-appointed-endowed-chairs,"August 1, 2019",yale_241
Juul users inhaling chemicals not listed,https://news.yale.edu/2019/07/30/juul-users-inhaling-chemicals-not-listed,"July 30, 2019",yale_242
Heart cells’ environment a potentially major factor in heart disease,https://news.yale.edu/2019/07/24/heart-cells-environment-potentially-major-factor-heart-disease,"July 24, 2019",yale_243
Yale’s Marcia Johnson elected to British Academy,https://news.yale.edu/2019/07/22/yales-marcia-johnson-elected-british-academy,"July 22, 2019",yale_244
Yale surgeons discuss how 3D printing technology is benefiting patients,https://news.yale.edu/2019/07/18/yale-surgeons-discuss-how-3d-printing-technology-benefiting-patients,"July 18, 2019",yale_245
Three faculty members appointed to endowed chairs,https://news.yale.edu/2019/07/18/three-faculty-members-appointed-endowed-chairs,"July 18, 2019",yale_246
Here’s how mammals went from big gulps to small swallows,https://news.yale.edu/2019/07/18/heres-how-mammals-went-big-gulps-small-swallows,"July 18, 2019",yale_247
Amy Arnsten appointed the Kent Professor of Neuroscience and of Psychology,https://news.yale.edu/2019/07/18/amy-arnsten-appointed-kent-professor-neuroscience-and-psychology,"July 18, 2019",yale_248
Parkinson’s disease study identifies possible new treatment target,https://news.yale.edu/2019/07/16/parkinsons-disease-study-identifies-possible-new-treatment-target,"July 16, 2019",yale_249
Pande and Shankar appointed to endowed chairs,https://news.yale.edu/2019/07/16/pande-and-shankar-appointed-endowed-chairs,"July 16, 2019",yale_250
Ramamurti Shankar named the Gibbs Professor of Physics,https://news.yale.edu/2019/07/16/ramamurti-shankar-named-gibbs-professor-physics,"July 16, 2019",yale_251
HIV DNA that lingers in spinal fluid may be linked to cognitive problems,https://news.yale.edu/2019/07/15/hiv-dna-lingers-spinal-fluid-may-be-linked-cognitive-problems,"July 15, 2019",yale_252
Yale researcher has a window seat for planning NASA’s Dragonfly mission,https://news.yale.edu/2019/07/15/yale-researcher-has-window-seat-planning-nasas-dragonfly-mission,"July 15, 2019",yale_253
Why smells don’t change with locations,https://news.yale.edu/2019/07/11/why-smells-dont-change-locations,"July 11, 2019",yale_254
Four faculty honored with Presidential Award in science and technology,https://news.yale.edu/2019/07/10/four-faculty-honored-presidential-award-science-and-technology,"July 10, 2019",yale_255
"George Veronis, pioneer of oceanography and fluid dynamics",https://news.yale.edu/2019/07/09/george-veronis-pioneer-oceanography-and-fluid-dynamics,"July 9, 2019",yale_256
"Yale doctors crack the code of a rare, inherited anemia",https://news.yale.edu/2019/07/02/yale-doctors-crack-code-rare-inherited-anemia,"July 2, 2019",yale_257
Decoding cells to unlock stem cells’ potential,https://news.yale.edu/2019/07/01/decoding-cells-unlock-stem-cells-potential,"July 1, 2019",yale_258
Crosstalk between cells allows Listeria bacteria to hijack immune system,https://news.yale.edu/2019/06/26/crosstalk-between-cells-allows-listeria-bacteria-hijack-immune-system,"June 26, 2019",yale_259
Scientists take big step towards producing novel polymers in living cells,https://news.yale.edu/2019/06/26/scientists-take-big-step-towards-producing-novel-polymers-living-cells,"June 26, 2019",yale_260
Yale scientists discover molecular key to how cancer spreads,https://news.yale.edu/2019/06/26/yale-scientists-discover-molecular-key-how-cancer-spreads,"June 26, 2019",yale_261
How the brain helps us make good decisions — and bad ones,https://news.yale.edu/2019/06/25/how-brain-helps-us-make-good-decisions-and-bad-ones,"June 25, 2019",yale_262
The secret of autobiographical memory is in assembly of cells,https://news.yale.edu/2019/06/25/secret-autobiographical-memory-assembly-cells,"June 25, 2019",yale_263
Study explores role of metabolism in immune cell behavior,https://news.yale.edu/2019/06/21/study-explores-role-metabolism-immune-cell-behavior,"June 21, 2019",yale_264
A bacterial remnant may explain arthritis in Lyme patients,https://news.yale.edu/2019/06/21/bacterial-remnant-may-explain-arthritis-lyme-patients,"June 21, 2019",yale_265
Hue times two: a second look at the color of dinosaur eggs,https://news.yale.edu/2019/06/21/hue-times-two-second-look-color-dinosaur-eggs,"June 21, 2019",yale_266
A tool for identifying phases of matter,https://news.yale.edu/2019/06/19/tool-identifying-phases-matter,"June 19, 2019",yale_267
"Gauthier, Bhullar featured in documentary, ‘When Whales Walked’",https://news.yale.edu/2019/06/19/gauthier-bhullar-featured-documentary-when-whales-walked,"June 19, 2019",yale_268
Tracking life’s first step: Two molecules ‘awaken’ brand new genome,https://news.yale.edu/2019/06/17/tracking-lifes-first-step-two-molecules-awaken-brand-new-genome,"June 17, 2019",yale_269
Ahn and Crews appointed to Malone professorships,https://news.yale.edu/2019/06/17/ahn-and-crews-appointed-malone-professorships,"June 17, 2019",yale_270
Craig Crews named the John C. Malone Professor,https://news.yale.edu/2019/06/17/craig-crews-named-john-c-malone-professor,"June 17, 2019",yale_271
Charles Ahn appointed the Malone Professor of Applied Physics,https://news.yale.edu/2019/06/17/charles-ahn-appointed-malone-professor-applied-physics,"June 17, 2019",yale_272
Same brain region weighs decisions made for others as well as for self,https://news.yale.edu/2019/06/14/same-brain-region-weighs-decisions-made-others-well-self,"June 14, 2019",yale_273
Cold quasars could rewrite our understanding of a galaxy’s lifecycle,https://news.yale.edu/2019/06/13/cold-quasars-could-rewrite-our-understanding-galaxys-lifecycle,"June 13, 2019",yale_274
Yale science hits the stage with ‘Quantum Sound’,https://news.yale.edu/2019/06/11/yale-science-hits-stage-quantum-sound,"June 11, 2019",yale_275
Art in Research winning images announced,https://news.yale.edu/2019/06/10/art-research-winning-images-announced,"June 10, 2019",yale_276
A Yale scientist’s research changed our understanding of dinosaurs,https://news.yale.edu/2019/06/03/yale-scientists-research-changed-our-understanding-dinosaurs,"June 3, 2019",yale_277
Gut check: Yale researchers describe role of bacteria in drug response,https://news.yale.edu/2019/06/03/gut-check-yale-researchers-describe-role-bacteria-drug-response,"June 3, 2019",yale_278
Physicists can predict the jumps of Schrödinger’s cat (and finally save it),https://news.yale.edu/2019/06/03/physicists-can-predict-jumps-schrodingers-cat-and-finally-save-it,"June 3, 2019",yale_279
Arthur Horwich wins Paul Janssen Award for Biomedical Research,https://news.yale.edu/2019/06/03/arthur-horwich-wins-paul-janssen-award-biomedical-research,"June 3, 2019",yale_280
"Murray Gell-Mann ’48 B.S., world-renowned physicist",https://news.yale.edu/2019/05/31/murray-gell-mann-48-bs-world-renowned-physicist,"May 31, 2019",yale_281
nEXO collaboration images single atom in solid rare element for first time,https://news.yale.edu/2019/05/31/nexo-collaboration-images-single-atom-solid-rare-element-first-time,"May 31, 2019",yale_282
Tree of life brought to scale by Yale scientists,https://news.yale.edu/2019/05/30/tree-life-brought-scale-yale-scientists,"May 30, 2019",yale_283
Alumnae look to change the digital conversation,https://news.yale.edu/2019/05/30/alumnae-look-change-digital-conversation,"May 30, 2019",yale_284
Peabody to preview renovation at free Community Day event on June 1,https://news.yale.edu/2019/05/29/peabody-preview-renovation-free-community-day-event-june-1,"May 29, 2019",yale_285
Researchers identify stem cell source of key process in female reproduction,https://news.yale.edu/2019/05/28/researchers-identify-stem-cell-source-key-process-female-reproduction,"May 28, 2019",yale_286
Three appointed to endowed chairs,https://news.yale.edu/2019/05/28/three-appointed-endowed-chairs,"May 28, 2019",yale_287
Alexander Goncharov named the Beebe Professor of Mathematics,https://news.yale.edu/2019/05/28/alexander-goncharov-named-beebe-professor-mathematics,"May 28, 2019",yale_288
Recent grad in astrophysics finds support in all-female cohort,https://news.yale.edu/2019/05/21/recent-grad-astrophysics-finds-support-all-female-cohort,"May 21, 2019",yale_289
"For data science that delves into the brain, Amin Karbasi wins CAREER Award",https://news.yale.edu/2019/05/17/data-science-delves-brain-amin-karbasi-wins-career-award,"May 17, 2019",yale_290
Study reveals role of neonatal brain cells in early bonding in mammals,https://news.yale.edu/2019/05/16/study-reveals-role-neonatal-brain-cells-early-bonding-mammals,"May 16, 2019",yale_291
Yale study identifies how cancer drug inhibits DNA repair in cancer cells,https://news.yale.edu/2019/05/15/yale-study-identifies-how-cancer-drug-inhibits-dna-repair-cancer-cells,"May 15, 2019",yale_292
Mehraveh Salehi wins first Ivy Three-Minute Thesis competition,https://news.yale.edu/2019/05/15/mehraveh-salehi-wins-first-ivy-three-minute-thesis-competition,"May 15, 2019",yale_293
Rebecca Kramer-Bottiglio appointed the Lee Professor of Engineering,https://news.yale.edu/2019/05/15/rebecca-kramer-bottiglio-appointed-lee-professor-engineering,"May 15, 2019",yale_294
Alumna brings Yale approach to MIT Space Exploration Initiative,https://news.yale.edu/2019/05/14/alumna-brings-yale-approach-mit-space-exploration-initiative,"May 14, 2019",yale_295
Math helps predict where trees cluster,https://news.yale.edu/2019/05/13/math-helps-predict-where-trees-cluster,"May 13, 2019",yale_296
A starter pack of data science tools for digging into any academic field,https://news.yale.edu/2019/05/13/starter-pack-data-science-tools-digging-any-academic-field,"May 13, 2019",yale_297
